{
  "$schema": "https://json-schema.org/draft/2020-12/schema",
  "$id": "syllabus.schema.json",
  "$defs": {
    "Lesson": {
      "additionalProperties": false,
      "properties": {
        "id": {
          "description": "Permanent ID: lowercase words joined by hyphens. It never changes across Syllabus versions, so Learner progress can be keyed by it.",
          "maxLength": 80,
          "pattern": "^[a-z0-9]+(-[a-z0-9]+)*$",
          "title": "Id",
          "type": "string"
        },
        "title": {
          "minLength": 1,
          "title": "Title",
          "type": "string"
        },
        "topics": {
          "items": {
            "minLength": 1,
            "type": "string"
          },
          "minItems": 1,
          "title": "Topics",
          "type": "array"
        },
        "exercise": {
          "anyOf": [
            {
              "type": "string"
            },
            {
              "type": "null"
            }
          ],
          "title": "Exercise"
        },
        "minutes": {
          "minimum": 1,
          "title": "Minutes",
          "type": "integer"
        },
        "materials": {
          "description": "IDs of Materials in this Syllabus.",
          "items": {
            "description": "Permanent ID: lowercase words joined by hyphens. It never changes across Syllabus versions, so Learner progress can be keyed by it.",
            "maxLength": 80,
            "pattern": "^[a-z0-9]+(-[a-z0-9]+)*$",
            "type": "string"
          },
          "title": "Materials",
          "type": "array",
          "uniqueItems": true
        }
      },
      "required": [
        "id",
        "title",
        "topics",
        "exercise",
        "minutes",
        "materials"
      ],
      "title": "Lesson",
      "type": "object"
    },
    "Material": {
      "additionalProperties": false,
      "description": "An external learning reference attached to a Lesson, Milestone or Question.",
      "properties": {
        "id": {
          "description": "Permanent ID: lowercase words joined by hyphens. It never changes across Syllabus versions, so Learner progress can be keyed by it.",
          "maxLength": 80,
          "pattern": "^[a-z0-9]+(-[a-z0-9]+)*$",
          "title": "Id",
          "type": "string"
        },
        "title": {
          "minLength": 1,
          "title": "Title",
          "type": "string"
        },
        "url": {
          "pattern": "^https://",
          "title": "Url",
          "type": "string"
        },
        "type": {
          "$ref": "#/$defs/MaterialType"
        },
        "subject": {
          "minLength": 1,
          "title": "Subject",
          "type": "string"
        }
      },
      "required": [
        "id",
        "title",
        "url",
        "type",
        "subject"
      ],
      "title": "Material",
      "type": "object"
    },
    "MaterialType": {
      "enum": [
        "book",
        "docs",
        "free",
        "paid",
        "paper",
        "platform",
        "tool",
        "video"
      ],
      "title": "MaterialType",
      "type": "string"
    },
    "Milestone": {
      "additionalProperties": false,
      "properties": {
        "id": {
          "description": "Permanent ID: lowercase words joined by hyphens. It never changes across Syllabus versions, so Learner progress can be keyed by it.",
          "maxLength": 80,
          "pattern": "^[a-z0-9]+(-[a-z0-9]+)*$",
          "title": "Id",
          "type": "string"
        },
        "title": {
          "minLength": 1,
          "title": "Title",
          "type": "string"
        },
        "kind": {
          "enum": [
            "build",
            "job-hunt"
          ],
          "title": "Kind",
          "type": "string"
        },
        "minutes": {
          "minimum": 1,
          "title": "Minutes",
          "type": "integer"
        },
        "materials": {
          "description": "IDs of Materials in this Syllabus.",
          "items": {
            "description": "Permanent ID: lowercase words joined by hyphens. It never changes across Syllabus versions, so Learner progress can be keyed by it.",
            "maxLength": 80,
            "pattern": "^[a-z0-9]+(-[a-z0-9]+)*$",
            "type": "string"
          },
          "title": "Materials",
          "type": "array",
          "uniqueItems": true
        }
      },
      "required": [
        "id",
        "title",
        "kind",
        "minutes",
        "materials"
      ],
      "title": "Milestone",
      "type": "object"
    },
    "Stack": {
      "additionalProperties": false,
      "properties": {
        "id": {
          "description": "Permanent ID: lowercase words joined by hyphens. It never changes across Syllabus versions, so Learner progress can be keyed by it.",
          "maxLength": 80,
          "pattern": "^[a-z0-9]+(-[a-z0-9]+)*$",
          "title": "Id",
          "type": "string"
        },
        "name": {
          "minLength": 1,
          "title": "Name",
          "type": "string"
        },
        "summary": {
          "minLength": 1,
          "title": "Summary",
          "type": "string"
        },
        "published": {
          "default": true,
          "description": "Whether Learners can choose this Stack. Set false to import a Stack before it is ready; a later version can publish or withdraw it.",
          "title": "Published",
          "type": "boolean"
        }
      },
      "required": [
        "id",
        "name",
        "summary"
      ],
      "title": "Stack",
      "type": "object"
    },
    "Week": {
      "additionalProperties": false,
      "properties": {
        "id": {
          "description": "Permanent ID: lowercase words joined by hyphens. It never changes across Syllabus versions, so Learner progress can be keyed by it.",
          "maxLength": 80,
          "pattern": "^[a-z0-9]+(-[a-z0-9]+)*$",
          "title": "Id",
          "type": "string"
        },
        "number": {
          "minimum": 1,
          "title": "Number",
          "type": "integer"
        },
        "title": {
          "minLength": 1,
          "title": "Title",
          "type": "string"
        },
        "goal": {
          "minLength": 1,
          "title": "Goal",
          "type": "string"
        },
        "deliverable": {
          "minLength": 1,
          "title": "Deliverable",
          "type": "string"
        },
        "interview_checks": {
          "items": {
            "minLength": 1,
            "type": "string"
          },
          "title": "Interview Checks",
          "type": "array"
        },
        "lessons": {
          "items": {
            "$ref": "#/$defs/Lesson"
          },
          "minItems": 1,
          "title": "Lessons",
          "type": "array"
        },
        "milestones": {
          "items": {
            "$ref": "#/$defs/Milestone"
          },
          "title": "Milestones",
          "type": "array"
        }
      },
      "required": [
        "id",
        "number",
        "title",
        "goal",
        "deliverable",
        "interview_checks",
        "lessons",
        "milestones"
      ],
      "title": "Week",
      "type": "object"
    }
  },
  "additionalProperties": false,
  "description": "One version of a Stack's Syllabus: its Weeks, Lessons, Milestones and Materials.",
  "properties": {
    "schema_version": {
      "const": 1,
      "title": "Schema Version",
      "type": "integer"
    },
    "version": {
      "description": "Syllabus version: the date it was made, e.g. v2026-09-26, plus .1, .2, ... for more versions on the same day. Versions sort by date, then by that number.",
      "pattern": "^v\\d{4}-\\d{2}-\\d{2}(\\.[1-9]\\d*)?$",
      "title": "Version",
      "type": "string"
    },
    "stack": {
      "$ref": "#/$defs/Stack"
    },
    "materials": {
      "items": {
        "$ref": "#/$defs/Material"
      },
      "title": "Materials",
      "type": "array"
    },
    "weeks": {
      "items": {
        "$ref": "#/$defs/Week"
      },
      "minItems": 1,
      "title": "Weeks",
      "type": "array"
    }
  },
  "required": [
    "schema_version",
    "version",
    "stack",
    "materials",
    "weeks"
  ],
  "title": "Syllabus",
  "type": "object"
}
