{
  "stack": {
    "id": "android-developer",
    "name": "Android Developer",
    "summary": "A 12-week plan to pass senior Android interviews: Kotlin and coroutines in depth, Flow, platform internals and the Android 16/17 changes, Jetpack Compose internals and at scale, architecture and DI, offline-first data, builds and release, testing, performance and security, and mobile system design.",
    "published": true
  },
  "weeks": [
    {
      "id": "w01",
      "goal": "Answer Kotlin questions at the level of semantics and generated bytecode, since Kotlin is in 94% of senior Android postings and interviewers test it first.",
      "title": "Kotlin in depth",
      "number": 1,
      "lessons": [
        {
          "id": "w01-l01",
          "title": "The type system: nullability, generics and variance",
          "topics": [
            "Nullable types, smart casts, platform types from Java and `!!`",
            "Generics: declaration-site variance (`in`/`out`), use-site projections and star projection",
            "`inline` functions, `reified` type parameters, `crossinline` and `noinline`",
            "`Nothing`, `Unit` and `Any` in the type hierarchy"
          ],
          "minutes": 90,
          "exercise": "Write a `reified` inline helper that parses JSON into a type, and explain from the bytecode why it works only because it is inlined.",
          "materials": [
            "kotlin-docs",
            "kotlin-in-action-2"
          ]
        },
        {
          "id": "w01-l02",
          "title": "Classes that model state: sealed, value and data classes, delegation",
          "topics": [
            "Sealed classes and interfaces for UI state and results; exhaustive `when`",
            "Data classes: generated members, `copy`, and pitfalls with mutable properties",
            "Value (inline) classes and when they are boxed",
            "Delegation: `by lazy` (thread-safety modes), `Delegates.observable`, class delegation"
          ],
          "minutes": 90,
          "exercise": "Model a screen's loading, content and error states as a sealed interface and write an exhaustive renderer.",
          "materials": [
            "kotlin-docs",
            "kotlin-in-action-2"
          ]
        },
        {
          "id": "w01-l03",
          "title": "Lambdas, collections, sequences and the K2 compiler",
          "topics": [
            "Scope functions (`let`, `run`, `with`, `apply`, `also`): when and why",
            "Lambdas and allocation: captured variables, SAM conversions",
            "Collections vs sequences: eager vs lazy evaluation and when sequences win",
            "The K2 compiler: what changed for smart casts and build speed"
          ],
          "minutes": 90,
          "exercise": "Benchmark a filter-map-take chain on a list and on a sequence, and explain the difference in work done.",
          "materials": [
            "kotlin-docs",
            "kotlin-k2-migration",
            "kotlin-whats-new-23"
          ]
        },
        {
          "id": "w01-l04",
          "title": "Idiomatic API design in Kotlin",
          "topics": [
            "Extension functions and properties: resolution is static",
            "Designing APIs with default and named arguments, and `@JvmOverloads` for Java callers",
            "Type-safe builders and DSLs with lambdas with receivers",
            "Java interop: `@JvmStatic`, `@JvmField`, nullability annotations and checked exceptions"
          ],
          "minutes": 90,
          "exercise": "Design a small type-safe builder DSL for a network request and review it for Java callers.",
          "materials": [
            "kotlin-docs",
            "kotlin-in-action-2"
          ]
        }
      ],
      "milestones": [
        {
          "id": "w01-m01",
          "kind": "job-hunt",
          "title": "Refresh your CV and LinkedIn for senior Android roles: lead with scale, ownership and shipped apps",
          "minutes": 120,
          "materials": [
            "linkedin-jobs",
            "androiddev-careers"
          ]
        },
        {
          "id": "w01-m02",
          "kind": "build",
          "title": "DSA track: 20-30 minutes a day on arrays and hash maps (big-tech loops are DSA-heavy)",
          "minutes": 150,
          "materials": [
            "neetcode-roadmap"
          ]
        }
      ],
      "deliverable": "A small Kotlin library (a typed result wrapper and a few extension-based APIs) with notes on what each feature compiles to.",
      "interview_checks": [
        "What does `inline` do to a lambda, and why is `reified` only allowed on inline functions?",
        "Is `lazy` thread-safe by default? When would you choose `lateinit` instead?",
        "Explain `in` and `out` variance with a real Android example.",
        "When would you use a sealed interface over an enum class?"
      ]
    },
    {
      "id": "w02",
      "goal": "Explain how coroutines suspend, switch threads, cancel and fail, since this is the single most-asked topic in senior Android interviews.",
      "title": "Coroutines internals",
      "number": 2,
      "lessons": [
        {
          "id": "w02-l01",
          "title": "Suspension, continuations and dispatchers",
          "topics": [
            "How `suspend` compiles: continuation-passing style and the state machine",
            "Dispatchers: Main, Main.immediate, Default, IO and `limitedParallelism`",
            "`withContext` and what a context switch costs",
            "`CoroutineContext` elements: Job, dispatcher, name, exception handler"
          ],
          "minutes": 90,
          "exercise": "Decompile a two-step suspend function and point out its state machine labels.",
          "materials": [
            "kotlin-coroutines-guide",
            "kotlinx-coroutines-source",
            "kotlin-coroutines-deep-dive"
          ]
        },
        {
          "id": "w02-l02",
          "title": "Structured concurrency",
          "topics": [
            "Scopes and the Job hierarchy: parents wait for children",
            "`viewModelScope`, `lifecycleScope` and why `GlobalScope` is discouraged",
            "`coroutineScope` vs `supervisorScope`, `Job` vs `SupervisorJob`",
            "Injecting dispatchers and scopes for testability and work that must outlive a screen"
          ],
          "minutes": 90,
          "exercise": "Load a profile and its feed in parallel with `async`, and make one failure cancel or not cancel the other on purpose.",
          "materials": [
            "android-coroutines",
            "android-coroutines-best-practices",
            "kotlin-coroutines-guide"
          ]
        },
        {
          "id": "w02-l03",
          "title": "Cancellation and exception handling",
          "topics": [
            "Cooperative cancellation: `isActive`, `ensureActive`, `yield` and cancellable suspend points",
            "Not swallowing `CancellationException` (the most common production coroutine bug)",
            "Exception propagation, `CoroutineExceptionHandler` and where it actually works",
            "`NonCancellable` and cleanup in `finally`; `withTimeout` vs `withTimeoutOrNull`"
          ],
          "minutes": 90,
          "exercise": "Write a CPU-heavy parser that honors cancellation, and a `runCatching` wrapper that does not swallow cancellation.",
          "materials": [
            "kotlin-coroutine-exceptions",
            "kotlin-coroutines-deep-dive",
            "android-coroutines-best-practices"
          ]
        },
        {
          "id": "w02-l04",
          "title": "Testing coroutines and interview traps",
          "topics": [
            "`runTest`, virtual time and `advanceUntilIdle`",
            "`StandardTestDispatcher` vs `UnconfinedTestDispatcher` and `Dispatchers.setMain`",
            "Testing timeouts, retries and cancellation",
            "Common traps: blocking calls in coroutines, `runBlocking` on the main thread, leaked scopes"
          ],
          "minutes": 90,
          "exercise": "Test a retry-with-backoff function using virtual time so the test runs in milliseconds.",
          "materials": [
            "android-coroutines",
            "kotlin-coroutines-guide"
          ]
        }
      ],
      "milestones": [
        {
          "id": "w02-m01",
          "kind": "build",
          "title": "DSA track: two pointers and sliding window, 20-30 minutes a day",
          "minutes": 150,
          "materials": [
            "neetcode-roadmap"
          ]
        }
      ],
      "deliverable": "A repository class with parallel network calls, timeouts and cancellation, plus tests that prove cancellation and error handling work.",
      "interview_checks": [
        "What is the difference between `launch` and `async`, and how do their exceptions differ?",
        "What happens when a child coroutine fails inside `coroutineScope` versus `supervisorScope`?",
        "Why is catching `CancellationException` a bug, and how do you avoid it?",
        "Cancelling a search stops the request but parsing keeps running. How do you fix it?"
      ]
    },
    {
      "id": "w03",
      "goal": "Use Flow correctly for UI state and data streams: hot vs cold, the right operators, lifecycle-safe collection and tests.",
      "title": "Flow and reactive state",
      "number": 3,
      "lessons": [
        {
          "id": "w03-l01",
          "title": "Cold and hot streams",
          "topics": [
            "Cold flows: each collector runs the producer",
            "StateFlow: conflation, equality and the initial value",
            "SharedFlow: replay, buffer and `onBufferOverflow`",
            "`stateIn` and `shareIn` with `SharingStarted.WhileSubscribed(5000)`"
          ],
          "minutes": 90,
          "exercise": "Turn a repository flow into UI state with `stateIn` and show what happens on rotation with each `SharingStarted` policy.",
          "materials": [